essay_id,example sentences
essay69,for example chewing gum next to cash register or putting healthy drink at eyesight level
essay69,for example placing healthy beverages within sight can help people quit carbonated beverages or alcohol and develop healthier life style habits
essay69,for example some banks may use word games to attract people to deposit which may lead to people who have not studied finance falling into traps and losing their assets
essay69,another example is about football lottery which is something i used to do in my senior high school time
essay69,the example in the previous paragraph is a nudge behavior that violates ethics
essay86,many nudges can have harmful side effects such as backfiring away from the desired behavior when people realize they are being pushed in one direction or another
essay86,for example when showing individuals their water usage over time it caused them to use less water but in response their electricity consumption increased effects of nudges
essay90,first it is important to determine what nudge truly means and to discuss some examples of nudging
essay90,there are some examples of nudge working successfully
essay90,one clear example is placing healthier foods at eye level schmidt engelen p
essay90,another example of nudging is implementing an opt out system for organ donation where the default is for people to donate their organs rather than having a default of not donating organs
essay90,a final example of nudge is by sending people feedback that compares their energy consumption to their neighbors effect iv iology
essay90,these are just some examples of nudging being used effectively
essay90,there are many different types and example of nudging but there are also different extents that nudging can be used
essay90,as long as this freedom of choice is clear to decision makers then nudge is ethical in most instances
essay90,nudge comes in many different forms such as presentation of information changes in physical environment changes in default social norms and commitment
essay90,there are examples of nudging being implemented successfully such as placing healthier foods at the eye level of people who are making decisions on what to buy or by showing people how much energy they are consuming relative to their neighbors
essay90,com nudge text examples 20of20nudges20include20 sending to 20post20on20social20 media
essay4,it is possible to create an ethics system where any sort of decision manipulation is ethical such as the system where anything that benefits a person is ethical and anything that doesnt is unethical
essay4,conversely an ethics system can be created that makes nudge always unethical such as if manipulation of any kind was deemed unethical regardless of its outcome
essay4,however in this system any manipulation that alters the individuals decision making process such as nudge will come at a utility cost
essay4,nudge has several instances of causing people to make better decisions than they otherwise would have
essay4,one such example is the save more tomorrow program described in a journal of political economy article by richard thaler and shlomo ben artzi
essay4,since the plan was optional could be opted out of at any time and didnt hide any details the manipulative cost of this example would be quite low and so the save more tomorrow program ends up being an ethical implementation of nudge
essay4,as with the previous example the manipulative cost of the nudge is low as it only provides additional information and isnt obscuring the decision
essay4,the manipulation cost is a bit larger than the other two examples though as people may not take time to look through all their options and assess them properly when they can just buy one of the first few things they see
essay4,since nudge always provides positive utility to society doesnt change the payoffs of a decision and doesnt obscure information then based on these three examples nudge is an ethical tool in shaping decision making
essay4,an example is the grocery store from above
essay4,one notable example that depends on nudge is gambling specifically the lottery
essay4,however the same mechanics that power nudge can also power unethical manipulation such as the lottery and there isnt a simple solution that both allows nudge and disallows such manipulation
essay53,for example there is increasing interest in using nudging as a tool to improve peoples health related behaviors blumenthal barby and burroughs 1
essay102,examples of nudges include default options social norms and personalized feedback
essay102,this is particularly relevant in the context of public health as many health challenges such as obesity and related diseases have behavioral roots
essay102,nudging can promote financial security through encouraging behaviors such as saving money paying bills on time and avoiding high interest debt
essay102,for example if a food company wants to increase the sales of their unhealthy products
essay102,for example imagine that a workplace promotes healthy eating habits by offering discounted healthy meals in the company cafeteria
essay102,recent campaigns have incorporated effective behavior change techniques such as goal setting monitoring and feedback which are effective in weight management
essay45,for example nudging a young child or someone with a mental disability may lead to adverse reactions
essay45,the effects of the presentation of data can be seen through word choice and examples
essay45,in example 1 you are threatened with losing 700 dollars
essay45,in example 2 you are threatened with losing 700 dollars
essay45,this example would be unethical if people are not persuaded to choose one option
essay45,there can also be unintended consequences from nudging such as regretting the decision they were influenced to make and moral licensing
essay45,for example the nudge r can place advertisements for things the consumer needs to remind them to purchase them
essay45,for example if you see many people recycling you are more likely to recycle if recycling becomes trending
essay45,an example of this is the one size fits all approach
essay45,in the example of recycling moral licensing may have adverse effects
essay12,nudges can appear in multiple different ways for example the way that information is presented changes in the physical environment having a default option set the existence of social norms and herding and establishing commitment and implementation of plans
essay12,for example in their paper nudging healthy college dining hall choices using behavioral economics schindler ruwi sch et al
essay12,umbilical cord blood is an essential source of hematopoietic stem cells necessary for treating diseases such as leukemia and lymphoma with a slim donation rate
essay12,for example nudges often can manifest as a form of a leading question which is a question that is looking for the person taking a survey to answer in a specific way not allowing them to go through their own specified step by step thought process
essay12,for example if during the presidential election next year the republican party really emphasizes the phrase do you really want to pay 5pera gallon of gas like you did last year
essay65,some examples include promoting healthy eating encouraging people to recycle increasing charitable giving increasing consumer spending or encouraging longer work hours
essay65,275 for example a nudge that encourages people to purchase a used car for a high price by only displaying that product prominently and not providing information about other options can limit consumer choice and reduce autonomy
essay65,for example by providing a college scholarship for only a year and not sharing the terms of the scholarship clearly and then reducing or removing the scholarship completely at the upcoming years will disempower students and their relatives financially
essay32,all of these mechanisms rely on understanding human behavior such as availability heuristics and loss a version
essay32,another everyday example of a helpful nudge is a commitment plan
essay32,one prominent example of this is several european countries opt out organ donation and transplant systems
essay32,several other countries such as france wales and scotland have adopted similar policies gra
essay32,in this example these countries utilize default settings to promote organ donation
essay32,a major example of this is the manipulation of how information is presented on ballots
essay32,a recent example of this was ohiosissue1
essay32,there should also be an understanding that there are some circumstances such as on voting ballots in which the use of nudging is completely inappropriate as they are a violation of autonomy
essay32,works cited abbas tahir examples of nudges in everyday life cmi9mar
essay32,com examples of nudges in everyday life
essay24,successful ventures that nudge its users into utilizing the product include fitness and sustainable shopping programs such as fit bit and thrive market
essay24,similarly thrive market highlights healthier or more sustainable products using terms such as organic non gmo and sourced using fair trade practices
essay24,as a result he knowingly or unknowingly accepts the products nudging capabilities to help him achieve his goal living healthily or eco friendly in the above examples
essay24,4 for example the plaintiffs in campbell v
essay73,for example when someone is in a store and walking up to a register to pay they may encounter a section in the line that contains many seemingly random items such as cell phone chargers and snacks encouraging them to spend more without directly telling them to do so
essay73,another example of nudging may include online retailers automatically opting you into their marketing campaigns rather than giving you the default option of not subscribing to them
essay73,however much of the controversy does not isolate nudging as a concept instead it confounds nudging with other concepts such as regulation and censorship
essay73,some examples of nudging include presentation of information changes in the physical environment changes in default social norms and herding as well as commitment implementation plans
essay73,for example altering how information is presented could impact freedom of choice
essay73,this is especially true for larger organizations such as government agencies or even news media
essay8,take for instance the social pressure to recycle or get vaccinated against dangerous diseases both of which are examples of being nudged by the social normand society benefiting as a result this is also called herding
essay8,this is an example of adjusting ones environment in order to gently push them towards a certain action
essay8,for example politicians will at times sneak an unrelated issue into a bill that makes major headlines a bill about climate change or abortion containing changes to the amount of benefits members of congress receive
essay8,this problem is especially evident in multicultural societies such as the unitedstates of america where many different peoples with many different cultural heritage s call home
essay8,examples of highly objective goals could be things like increasing any of the following the relative health levels of the public the quality of life or the average income level
essay49,for example a supermarket may use nudging in information search to promote a certain food by placing it above eye level however if the supermarket tells the customers that the food can prevent cancer they manipulate the customers buying decisions through misleading and exaggerated information
essay49,a good example is when the government is trying to nudge people in ways that benefit society
essay49,goals that the government promote such as preventing people from smoking to make the public healthier is usually a long term goal that requires not only one individual but the effort of all others
essay49,therefore its utility will be largely reduced and will be nothing compared to short term satisfaction such as smoking a cigarette or using plastic bags for convenience
essay48,for example presentation of information changes in their physical environment changes in default social norms and herding and commitment or implementation plans
essay48,in each of these examples nudging can be used to highlight both good and bad decisions depending on the intention of those doing the nudging
essay48,when looking at the examples of nudging in class a portion of them can be seen as beneficial to society or the individual
essay48,for instance putting healthier food at eye level in the grocery store giving the option in printing to print multiple documents on one page or printing on both sides of a paper to save paper or the example from the hotel where it encourages guests to reuse towels by citing that 75 of guests took part in the resource saving program
essay48,on the other hand there are also instances when nudging can be used for gain solely by the people doing the nudging though it may seem relatively harmless to those being influenced
essay48,for instance with the grocery store example in the picture healthier options can be seen to be on eye level for grownups but un healthier drinks can be seen on the lower levels
essay48,another example thaler gave was being recommended by the united airlines app to pay for travel insurance that covered ticket cancellations
essay48,thirdly there should be a good reason to believe that the behavior being encouraged will improve the welfare of those being nudged this can be seen in the travel insurance example where only the company benefited and the consumers lost money after being tricked into spending money on an ultimately pointless purchase
essay9,a successful program to be used as an example for this is the spanish organ donor system
essay9,while some vehemently opposed to this may claim that this system is an example of government overreach there is still an option to not be a part of this system making the argument confusing at best
essay9,an example of this could be seen in cafeterias when arranging food
essay9,this is yet another example of how nudge is essentially tricking peoples brains into assuming the default to be whatever the architect of the given system wants them to believe it is
essay9,another example of nudge that has been used by researchers is making the participants feel that they are performing above average and as such should continue with their actions to ensure this continued superior performance
essay9,an example of this could be seen in research regarding patients adherence to routinely taking their medications and reporting so to their doctors
essay9,the counterargument to this point would simply be that the method being used is not so much unethical as much as it is the goal of those who designed the advertising campaign
essay72,another example of this type of nudging working well is for encouraging people to take the covid19 vaccine during the height of the pandemic
essay72,a good example of this is placing cigarettes close to the checkout areas in convenience stores
essay72,another classic example of this specific type of nudge is when stores place candy bars and other sweets near the checkout lines
essay72,statistics of some products that nudge people to buy one product or another is a good example of showing how nudging can easily become manipulation
essay72,an example of this is when people get sent a message for their high usage of a product such as gas
essay25,for instance a store may put healthier and more expensive foods in a more prominent position but if the store doesnt place less healthy options in order to sell more expensive foods then the store is manipulating not nudging
essay25,a quintessential example is the automated deduction of taxes directly from individual salaries typically inclusive of contributions to pension programs
essay25,for instance there are individuals who may not prioritize retirement deriving profound fulfillment from continual work with the intention of remaining employed for life
essay25,for instance the use of sugar substitutes in diet sodas might lead individuals to compensate by consuming more sugar from other sources
essay25,lastly as a student from china i would like to use a chinese case to illustrate the nudges that can occur in different cultural contexts
essay33,popular examples of nudging include placing healthy food options in direct line of sight and automatically enrolling employees in an optional 401k plan
essay33,this essay will explore the pillars of autonomy transparency and justification discuss the consequences of nudging and provide examples of ethical and unethical nudges
essay33,smartphone notifications are becoming increasingly popular and provide an excellent example of autonomy variations within nudging
essay64,nudging examples a downside of nudging is that it can lead to consumers being manipulated but where is the line drawn between a simple nudge and lies meant to manipulate consumers
essay64,for example to help reduce smoking horrible images and bolded text of the side effects of smoking can be put on the side of cigarette packing or advertisements to decrease the likelihood of someone smoking
essay64,this example of nudging has an ultimately good intention showing what the consequences of smoking ethical implications of nudge can be without hindering a persons freedom
essay64,another example is putting healthier food options such as fruits and vegetables at eye level with customers in dining halls compared to the less healthy foods to help promote healthier eating choices
essay64,shatz this example of nudging again has an ultimately good intention while still providing all options for a person to choose
essay64,an example of a dark nudge would include a company only offering the expensive options to a customer and hiding the cheaper options
essay64,another example is putting unhealthy food options such as chips and candies in an easy to find location so it encourages people to buy them more than the healthier foods
essay64,for example promoting health and safety can overall improve peoples living conditions by guiding them towards good choices
essay64,most recently during the covid19 pandemic people have argued their freedom of choice when it came to topics such as getting vaccinated or wearing facemasks
essay64,another example is in a political election situation nudging may result in conflict with an individuals values or preferences
essay64,for example some biases are memory related
essay64,com nudge dark nudge sludge dealing with ethics be text for 20 example 2c20hiding20some20 cheaper unsubscribing 20are20 definitely 20dark20nudges
essay13,building off of the previous point about policy there is one example of fiscal policy enacted by the government which has some sort of nudging boost component to it and this comes in the form of cigarette and soda tax
essay13,local and national governments often levy taxes on unhealthy goods such as cigarettes and sodas
essay13,these examples lay the groundwork for the big debate on how ethical we believe it is to employ nudge
essay13,for example in order to effectively use nudge without taking advantage of a customer i think that nudge should be used lightly and with nothing too big
essay52,such factors include the type of nudge technique being used the motivations behind the nudge and an individuals ability to discern when nudging is being utilized
essay52,this essay will explain each form of nudging provide common examples discuss the motivations behind them discuss how easy they are to identify and determine how ethical they are
essay52,for example say a company produces a product that costs them 2 to make
essay52,an example that was discussed in class regarding this nudge was companies such as grocery stores and gas stations purposely put healthier food at eye level and unhealthy food either above or below
essay52,this type of nudge is much easier to identify when compared with the previous one
essay52,words such as fat free diet zero sugar and organic are commonly used on food labels to emphasize they are a healthy option
essay52,so if a consumer sees that a majority of the food with labels such as these are right where they can see and others are higher and lower they can distinguish the nudge
essay52,in the case of food delivery service applications such as uber eats and grub hub changes in default are used in the tipping mechanism for the drivers
essay52,in this example the nudge is made more difficult to see by the process which needs to be done in order no give not ip
essay52,an example provided in class showed two hotel door tags urging people staying in the hotel to reuse their laundry in order to help save the environment
essay52,for example the hotel may want to do less laundry in order to cut costs buttrick their guests by appearing environmentally conscious
essay52,a good example of this nudge is our term challenge in econ330
essay52,for this example the motivation is based on self improvement
essay52,this is a good example of a nudge being ethical
essay52,if the motivation is beneficial to entities such as the environment customers or social welfare the nudge can be considered ethical
essay5,one example of this is in grocery stores
essay5,for example in the workplace managers and leaders can send alerts to encourage physical activity or have fitness challenges amongst colleagues
essay5,one example of this is in healthcare
essay5,for example newspaper companies and magazines offer free monthly trials to lure consumers into utilizing their products
essay5,welfare in nudging is when nudging is only used to advocate for mutually shared goals such as people getting in shape or eating healthier foods
essay5,manipulation in nudging is when nudging is used to promote one sided goals such as getting vaccinated or subscribing to a newspaper company
essay91,examples of nudge include default options simplification of choices and social norms
essay91,for instance in education the use of rewards such as certificates and medals has been shown to motivate students to perform better in academics
essay91,similarly nudge that rely on information asymmetries such as those used by marketers or social media platforms can undermine individuals ability to make informed decisions and protect their privacy
essay91,examples of successful nudging strategies one example of a successful nudging strategy is the use of calorie labels on restaurant menus
essay91,for example a study conducted by the new york city department of health and mental hygiene found that individuals who were exposed to calorie labels on menus consumed an average of 106 fewer calories per meal than those who were not exposed to the labels
essay29,one such example is schools who wanted to promote healthier eating habits in children
essay29,some real world examples of this are charities and social advertising
essay68,for example when a retirement savings plan is set as the default option individuals who might have otherwise procrastinated or struggled with making a choice can benefit from the ease of the default option and secure their future finances
essay68,by attaching a financial benefit to certain choices individuals are motivated to examine such alternatives that they may have overlooked due to habit or due to limited information
essay87,some nudges can be manipulative as by definition above such as when there is a non positive change in the environment that results invulnerable individuals changing behavior
essay87,for instance a massive billboard sign on a highway advertising unhealthy food could manipulate hungry individuals to eat food that is not healthy for them
essay63,for instance a decade ago the british government wished to raise peoples awareness of energy conservation and use more efficient led light bulbs
essay63,in other words although the government would use nudging strategies such as presenting information or herding to imply the public select a healthier diet many people would ignore such induction
essay63,however the governments nudge for a healthy diet can not fulfill such a task
essay63,opposed such an idea through his public choice theory and suggested that the politicians often act for their private interests dhir par
essay63,instead applying nudge in education such as helping elementary school students to develop good study habits could be a proper utilization
essay22,for instance the default setting of organ donor or not organ donor can be changed to impact the percentage of people who participate in organ donation
essay22,an unethical example of a nudge involving the change of a default setting occurs when there is a lack of transparency about what each decision entails especially in regards to hidden costs
essay22,in this example the consumer is not informed of the implication that they will be charged in the future should they decide to participate in the free trial
essay22,the organization of grocery store shelves to promote the consumption of healthier foods is an example of an external factor that consumers do not control therefore the store deciding to organize it one way or another to promote certain eating habits is ethical because they are exercising control over something that they always have just with certain motivations
essay22,by focusing on the example of default settings the importance of transparency is demonstrated
essay75,for example to save the environment reducing the consumption of paper can be applicable and with the application of a nudge such a process can be propelled
essay75,as the author indicates for instance in terms of organ donation countries with an opt out system which means all residents are automatically organ donors are automatically considered as organ donors unless they chose to quit poses a significantly higher risk of becoming organ donors than countries with optin system
