essay_id,example sentences
essay75,another concern of nudge is that such application will not always guarantee the optimal outcome and sometimes the outcome is unintended and will backfire with negative outcomes wang19
essay75,for instance author robinson conducted an experiment using nudges by offering students an award for attending class
essay75,for example residents who received feedback about their water consumption reduced the consumption of water with higher usage of electricity tiefe nk ect et al which signifies inefficiency
essay75,for example in terms of organ donation to avoid people who make unacknowledged decisions with all options being outlined explicitly and transparently it will still yield more organ donors
essay75,for example both application of attendance award and feedback of water usage have not been widely implemented
essay75,indeed the application of nudges will yield negative outcomes such as manipulation concerns or unintended results
essay59,for example a simple change to the way a menu is presented in a restaurant may be enough to encourage customers to choose healthier options without requiring significant financial investment
essay59,for example a nudge that encourages people to sign up for a particular insurance plan could be seen as manipulative if the plan is not actually the best option for them
essay59,for example a nudge that encourages people to eat healthier may inadvertently lead to increased food waste or other negative outcomes
essay59,for example participants who were nudged towards taking the stairs instead of the elevator felt that they had not made a genuine choice to do so and that their behavior had been shaped by external forces
essay59,for example participants who were told that most people in their community recycle regularly were more likely to recycle themselves even if they did not believe that recycling was important
essay59,for example governments or corporations could use nudges to steer people towards behaviors that are harmful to themselves or others
essay59,there are a number of examples of nudges being used in ways that could be seen as manipulative or unethical
essay59,for example some credit card companies have used nudges to encourage people to make minimum payments rather than paying off their balance in full even though this can lead to significant interest charges over time
essay59,in another example some employers have used nudges to discourage employees from taking breaks or using sick leave which can have negative impacts on employee health and wellbeing
essay18,on the positive side nudging has been met with enthusiasm in situations like public policy or examples where nudging has prompted positive outcomes for the general public
essay18,another example of a positive outcome from nudging is the increase in consumption of healthy food when healthier items were placed at eye level in the grocery store
essay18,some negative examples of nudging include non disclosed enrollment fees where schools automatically enroll students in programs without disclosing fees that are associated with those programs causing financial turmoil for some families and social media platforms maximizing data sharing by setting default privacy settings to setting that cause users to share more information than they were aware of or may have intended
essay18,these are examples of how by withholding information nudging then becomes manipulative and unethical
essay18,for instance nudging people into certain plans like the savings plan led to a decreased participation in other benefit plans that were important like life insurance and health care through its altering of individuals financial plans and priorities
essay18,not all of nudging should be condemned as proven through the many benefits different examples of nudging have shown
essay18,however for smaller cases examples that are pro environment or pro healthier eating arent considered detrimental
essay18,lighter examples of nudging where there is a clear intent for benefit of the individual or society as a whole with complete transparency where all of the options available are presented does not cross the line into manipulation and is therefore not unethical
essay18,the ethical concerns of nudging can be confusing in the lines that are blurred and the many different examples of nudging that can be analyzed at different levels of ethicality
essay80,benefits of nudging firstly nudging can be used to encourage desirable behaviors such as healthy eating regular exercise and responsible financial management thaler sunstein 2008
essay80,unlike other interventions such as regulations or taxes nudges are low cost and can be easily implemented in a variety of settings
essay80,for example a nudge that works well in a western culture may not work in a collectivist culture where group norms and values are more important than individual preferences
essay80,for example if a government were to use nudges to encourage people to adopt a particular political ideology it could be seen as an attempt to manipulate the population rather than allowing them to make their own decisions
essay80,for example a company could use subtle cues in their marketing materials to encourage people to buy their products even if they do not necessarily need them
essay38,in his article gigerenzer refers to the example of health organizations frequently using nudges to persuade women to perform monthly breast self examinations
essay38,whether the choice architects in this example are unaware of the lack of scientific evidence supporting the practice or are motivated by conflicting interests the nudging is ultimately serving the interests of the multi million dollar mammogram ming industry and not the average female decision maker gigerenzer 2015
essay38,for example an individual living in poverty who does not have access to the internet or transportation would likely have a much more difficult time opting out of the organ donation program that they were automatically enrolled in than an upper middle class individual with a laptop and a car
essay38,while successful examples such as the save more tomorrow program and opt out organ donation policies demonstrate the potential for positive societal outcomes the overarching concern remains rooted in the compromise of individual autonomy
essay79,people subconsciously use nudge to convince others of their opinions and proposals such as going to a party or staying in
essay79,an example of nudge being tactfully used in todays society is the presentation of information
essay79,when joe biden won the race for presidency for example there was the capitol building riots where protests broke into the capitol building storming into the offices of political leaders
essay79,these examples present a massive issue amongst the unitedstates as freedom of press is one of the most important rights provided to those residing in our country but this also provides the freedom for news outlets to cross the line of nudging and manipulation through spreading misinformation to all
essay79,earlier examples of unethical nudging can also be expressed through advertising campaigns of harmful products such as cigarettes where social norms of smoking lead many to believe that it was a cool thing to do
essay79,this herding effect can lead to vulnerable groups such as new college students to overindulge without knowing their alcohol limit leading to severe consequences such as addiction or even death
essay79,other big corporations such as grocery stores also take advantage of nudge placing items they want you to buy usually those that cost more at eye level such that they earn more money from shoppers
essay79,they also organize the location of specific items such as dairy as far from the entrance as possible hence making shoppers walk into the back of the store
essay79,the examples listed above show how powerful nudge can be when used in a strategic manner
essay79,another positive impact of nudge use is the promotion of health products such as getting the vaccine for covid19
essay79,phrases such as join the resistance get vaccinated are used to promote vaccination in order to protect others from covid19 taking advantage of the social normand herding effects of nudge
essay79,positive social movements such as recycling and saving the planet could also be promoted through nudge
essay96,these are all examples of nudge in our daily life and it has become a psychological technique that the government or companies apply to alter our decisions
essay96,for example in certain public space there are rules that one can not smoke
essay96,my personal example would be the app apple music
essay2,changes in the choice architecture affects the outcome of decision making for example the ordering of choices matter if people see certain items first they are more likely to buy them sunstein
essay2,take for example setting a default option organ donation rates typically exceed 90inoptout countries compared to 15inopt in countries mackay and robinson
essay2,the manipulative aspect of loss a version lies in its ability to exploit deliberative thinking instead aiming to exploit pathos such as guilt shame and fear roprethomarandkneevicvel bar
essay55,for example instead of telling a10 year old child to go to bed and expect them to get ready on their own a parent can try to do it with them creating a culture where getting ready for bed can be better or maybe even pleasant
essay55,for example if an action causes 80 of your classmates to fail a class but20 to pass does the placement of 80failingand20 passing before or after one another change the decision made
essay55,thaler and sunstein s work nudge begins with an example of the changes in the physical environment nudge although it is fictional 2008
essay55,looking at the overall definition of nudge it is considered by founders thaler and sunstein to be an example of libertarian paternalism thaler sunstein 2008p
essay55,so when libertarian modifies paternalism it describes an action done by a choice architect for example the cafeteria worker who rearranged the food attempting to influence choices of individuals but ultimately the individual has freewill and can decide against the influence
essay55,for example it is a societal norm for americans to want to be organ donors 95 of americans are in favor of being an organ donormullett2022
essay55,this is an example of the changed default nudge
essay55,another example of the societal norms nudge is the commercials that were put out to encourage covid19 vaccinations
essay55,this is an example of presentation of information nudge because they could have said 1outofevery10covid deaths were people younger than 50 but that does not nudge the audience they are targeting
essay55,that is because people can repost advertisements such as the covid19ads to show they are in support of vaccinations
essay55,one of these examples is the jonestown massacre
essay55,some of his final words are an example of the societal norms nudge if we cant live in peace we must die in peace eldridge 2023
essay55,this nudge saying that the entire congregation must choose to do this is an example of how nudge can have negative effects on society
essay55,for example if you give your friend a peanut butter sandwich that is not inherently good or bad
essay43,all of these nudges and more play on our subconscious decision making mechanisms by subtly affecting the choice architecture of a given situation such as choosing what to buy at a grocery store
essay43,we can even use nudges for our own everyday benefit by for example placing shirts i like wearing at the top of my drawer so i wear them more often
essay14,for instance when you are looking at an item online there is commonly a section titled items commonly bought with this or something similar
essay14,an explicit example would be for someone buying plastic cups a website might recommend they also purchase paper plates as these items are commonly bought at the same time
essay14,the associated hazards are not apparent in this example
essay14,the stakes are relatively low and nudging seems like a harmless even beneficial strategy for the purchaser
essay14,lets modify my previous example so that it is not as blackandwhite
essay14,imagine this website has collected data on you based on your location for example
essay14,now take the example when based on this data the website steers the customer toward certain products or brands by making it difficult to find alternatives
essay14,this nudge is much harder than the one in the previous example bordering on manipulation
essay14,however since you can never fully control the outcome of such tactics nudges can create inadvertent risks and biases
essay15,nudging is widely used and if people carefully think about the example of the nudge in daily life it will be figured out how usual and frequent nudge has been used
essay15,for example if someone is overweight his parents change his dinner plates to a smaller one and the un obvious change makes his parents belong to nudge
essay15,for the changes in the physical environment the easiest example has been discussed during the class in the convenience store healthier products like milk and yogurt are usually placed at eye level which would remind and persuade customers to pay more attention to their health
essay15,its different from the first example
essay15,for the first example the convenience store mainly considers customers health
essay15,for instance every citizen is supposed to pay our taxes on time so when the british government intends to remind and nudge citizens to pay their taxes on time by adding the line most people pay their tax on time in letters to taxpayers halpern and michael 2016 it would not relate to the ethical issue
essay15,9 examples of nudging in the workplace people managing people people managing people
essay42,cialdini provides an example of the principle through the lens of retail clothiers
essay42,for instance a man might initially reject the idea of spending 95 for a sweater but if he has just bought a495suit in the store then the 95 sweater will not seem that excessive
essay42,although the prior example shows nudging as a deceitful tactic that only benefits a single party there are other dimensions in which it could be used to positively influence multiple members of society
essay42,for example organizations such as kroger and macys often hold auctions to sell items that can nudge individuals to donate more money to charities
essay54,6 nudging has gained popularity in fields such as public health environmental conservation and economic policy among others
essay54,for instance within a presentation of information nudge information is framed in a specific way that may feel more advantageous to the audience
essay54,for example 75 of people who took this drug beat cancer as opposed to 25 of our test subjects passed away
essay54,separately other types of nudges such as changes in physical environment or changes in default are less about spoken written word and more about the physical layout of life
essay54,for example automatic enrollment to weekly company newsletters after buying a product
essay54,nudging techniques such as changes in presentation of information physical environment defaults social norms and commitment have shown effectiveness in promoting positive behaviors
essay54,studies such as the printer experiment by dr
essay3,there are many examples of this nudging some of which will be covered by this paper but its important to note that there is controversy surrounding the ethicality of this practice
essay3,one example of such nudging was conducted by a group of researchers in a paper named are large portions always bad in which the authors present food in various size containers on packaging and find that by giving the impression of a larger portion on product packaging consumers find the food more desirable but also subsequently decrease the amount that they serve themselves petit2018
essay3,this is an example of how the way information is presented has a drastic impact on consumer behavior suggesting that the food industry could utilize this knowledge to control consumer portion size and decision making
essay3,while the question of whether or not nudging may actually be able to make large scale chance considering much of the research that currently exists is small scale as the examples discussed above goodwins argument that nudging is completely unethical is not sound if consumers are aware that the nudge is occurring then it does not strip them of their rights or autonomy and merely serves to give them an indication of the socially optimal outcome
essay78,how a cell phone carrier presents various plans on its website and where a grocery store places promotional items are examples of a choice architecture
essay78,changing a grocery stores displays of promotional items is an example
essay78,listing items for sale based on ratings submitted by other customers is an example of herding
essay78,in both examples about hotel towels and rated items above the bias is in the form of information
essay78,a real life example of this commitment nudge is the save more tomorrow program
essay78,in the wireless plan example above customers can see that there are options and discern that the prominent display of the best value plan means the plan is the company s choice therefore a disclaimer is not needed
essay78,even less transparent than this wireless plan example are subtle nudges where people do not realize that they are being nudged
essay78,while the spirit of nudging requires that nudges be transparent two examples that ts themselves have used are actually subtle nudges a grocery stores placements of items to increase consumptions of healthy foods and the amsterdam schiphol airports use of a fly image etched to each urinal to lessen the mess in the restroom s35
essay78,those examples show that lack of transparency is not straightforward
essay78,for example a salesperson influences a frugal customer who needs a basic cell phone to purchase a top of the line cell phone with features that the customer does not need
essay78,singapore again can be used as an example
essay78,in another example a survey of acceptances of governmental nudgesin8 countries found that china and south korea showed high approval rates for all 15nudge questions while japan scored the lowest in12 questions sunstein et al
essay78,in the wireless plan example above the choice architect has to design the web page showing the different plans even if the architect has no intention to promote a particular plan
essay78,we can use the current mortgage rate situation as an example
essay97,for example in their article on nudging and the ethics of behavior change loewenstein 2019 argues that transparency is essential for maintaining trust and respecting autonomy in nudging interventions
essay97,for example a study by smith and goldstein 2019 found that nudges related to recycling were more effective in individualistic cultures where personal choice and responsibility are emphasized compared to collectivist ic cultures where group harmony and social norms are prioritized
essay97,for example in some cultures subtle interventions may be seen as manipulative or disrespectful while in others they may be seen as a form of gentle persuasion or social influence
essay97,for example in their article on cultural variation in nudging bicchieriandxiao2019 argue that nudges should be tailored to cultural norms and expectations in order to be effective and ethical
essay97,for example loewenstein 2019 argues that nudges should respect individual autonomy and be based on scientific evidence regardless of cultural norms
essay97,nudges should be tailored to the specific cultural context to be effective and respectful but should also respect universal ethical principles such as autonomy and scientific rigor
essay97,for example if nudges are designed to promote behaviors that benefit certain groups over others they could be seen as unfair or discriminatory
essay39,to better form a perspective on the ethical implications of nudging the benefits and drawbacks of such strategies should be delineated
essay39,another instance of nudging is very typical of modern times and can be observed in local supermarkets
essay39,such an example presents the bidirectional benefit of nudging in daily life
essay39,one example of this is in the business of money lending
essay81,some tradi gonal methods of inu encing peoples behavior such as educagonalacgviges or punishment require a lot of money and resources to achieve
essay81,for example in2020abrigshorganizagon found that people consume a lot of salt when they eats hand chips
essay19,people encounter this phenomenon everyday from every day situations such as shopping in the supermarket to important decisions about their own lives for example whether they want to donate their organs or not
essay19,a prominent example of using the default rule isoptin or opt out organ donation
essay19,a prominent example of this is the default nudge of the opt in vs
essay19,based on this example it can be debated if it is ethical to use nudges that people may not be aware of
essay58,for example many grocery stores place certain products at eye level in order to entice customers to purchase the first thing they see
essay58,returning to the grocery store example some brands may pay to have lavish product displays that might block other products
essay58,for instance websites stores can set the default to receive marketing materials sales new products etc
essay58,such a tactic employs full transparency since the customer has the option to opt out
essay58,if the previous example required customers emails to make a purchase and only gave them the option to unsubscribe from emails after they received a few the method would be considered manipulation
essay58,the american smoking rate is a good example of the way that social norms and herd mentality can be used in nudging
essay58,while such a move was supported in the u
essay58,sin other countries where smoking is an important cultural aspect such a move may not necessarily be seen as an ethical thing
essay58,through the use of nudging from the government lars t ummer argues people perceive such actions as ethical or not based on framing in the media
essay58,t ummer uses the pandemic as an example of the way the government handled the situation and their nudges to get people to wear masks or to get vaccinated
essay58,hence the media holds politicians to account in some instances larstummer2022
essay58,the media does a good job protecting the general public but there are instances where targeting certain groups is necessary in order to make nudging more effective
essay58,not only can this lead to unintended consequences but such actions could lead to negative outcomes for individuals and society alike
essay58,it can be easy to see how there are many ways in which this is violated but there are plenty of examples of nudging where personal violation is not within question
essay58,this type of nudging is a good example of ethical ways to go about nudging that may avoid unintended consequences but still stay within the nudging ethical lines and not crossover into manipulation
essay74,in the example of personal saving individuals were nudged to save more of their income by utilizing a commitment device
essay74,institutions have the power to make massive differences in the public s behavior but when causing change on such a massive scale there is an increased risk of unintended consequences
essay74,one example of this behavior can be seen in reactions to covid19 policies with some proudly flaunting their lack of masks and vaccination
essay74,there are some other confounding factors such as political affiliation so this is perhaps not the best example
essay74,one more concrete example of unintended side effects causing negative impacts on individuals is a study published in the review of financial studies focusing on credit card fees
essay74,such an unintended consequences add les policy makers with the ethical responsibility to carefully study the impacts of nudges they deem necessary in order to avoid harming individuals
essay23,however if we can bypass the will of people without moving and directly influence peoples decisions the whole process will be much easier and more reliable
essay23,for example clearly labeling calories and nutritional information on food packaging can help consumers better understand the health impacts of food and therefore make more informed choices
essay23,for example in a behavioral economics class at case western reserve university the professor had us list a challenge we wanted to overcome in the first class and post it
essay23,results show that such a simple method can increase the success rate of quitting smoking by53
essay23,nudge has its drawbacks such as hidden nudges fraudulent nudges violation of individual rights and manipulative tactics
essay23,for example a social media celebrity shared a photo on her account showing her using a new skincareproduct
essay23,for example some organizations like to deliberately exaggerate the effectiveness of a product or hide potential risks
essay23,if the means of light pushing involves the violation of an individuals privacy or autonomy for example by collecting and using personal data to personalize push messages it may raise ethical issues
essay62,for example living in an american culture means that one will generally favor more individualistic choices over collectivist ones since individualism and pulling oneself up by their bootstraps is a revered american ideal
essay62,building on my previous college example other historically marginalized groups may not be encouraged to pursue college due to cultural norms about who deserves to go to college
