essay_id,example sentences
essay71,take for example it has become a common practice in recent years for employers to enroll their employees in a retirement plan by default with the absence of libertarianism everyone would be forced to enroll in a retirement plan most likely with the use of fines or penalties of some sort
essay71,for instance hausman and welch2010 gave an example of how the change in the layout of the food presented in the cafeteria encourages students to choose healthier foods
essay71,for instance if someone ends up with an objectively worse outcome in life e
essay71,thus this illustrates an example of how nudging could have a potentially unethical result in the long run when combined with a culture of collectivism and wanting to fit into what the majority of people are doing
essay26,system 1 is often used and refined in tasks that we repeat frequently so tasks such as driving shopping or many other mundane tasks that we have grown accustomed to overtime are often handled by this first system
essay26,egebarkandekstrms2015 study is an example of the change in default method where the two researchers aimed to reduce paper consumption in a swedish university by relying on peoples tendency to stick with the default option 2 by simply switching the default printer settings of the university to print double sided pages the university s daily consumption dropped by 15
essay26,an example of a potential practice might be automatic tax returns 3
essay26,there are so many examples where nudging has been used to promote healthy eating habits improve saving strategies and make just small changes in behavior that have lasting outcomes
essay26,with mistrust in government and companies who have often shown to put their priorities in front of the greater good giving them such a tool to do so should be called into question
essay26,even in examples where the nudging is effective unintended consequences can be just as impactful
essay30,the use of advertisements such as these and marketing strategies beg the question why do these methods work on consumers
essay30,a prime example of this is choosing between eating pizza for lunch or having a salad
essay30,in this paper these questions will be explored with concrete examples used to describe each
essay30,going back to the previous example an individual who is deciding what to eat for lunch will always have two or more options in this context
essay30,an example of this can be found in text written by richard thaler and cass sunstein nudge improving decisions about health wealth and happiness in which various foods were placed behind above or at eye level of an individual
essay30,an example of a change in default nudge is automatically renewed payment plans or subscriptions
essay30,this example of nudging however may disadvantage the user especially if they were planning on canceling their plan but just forgot to
essay30,one example of a social normand herding nudge is if the individuals are informed about what others are doing which then thereby induces an altered behavior
essay30,for example if a whole line of students were to say they think that the sky was red the next individual would be more inclined to say the sky was red
essay30,an example of this nudge is when news anchors purposefully use statistics that sound more impactful to influence populations
essay30,the previous examples are critical to understanding how these five types of nudges work in the real world though it is still important to delve into and understand the theory behind the concept of nudging
essay30,the inventors of the nudging concept thaler and sunstein believe nudging to be an example of libertarian paternalism
essay30,going back to the lunch example individuals are pushed to make healthier lifestyle choices due to the existence of nudges
essay30,for example if you put a marshmallow in front of an individual and place a vegetable further away the individual may reach for the vegetable for some unknown reason that nudge does not account for
essay30,an example of inappropriate use is black friday marketing
essay30,this marketing is extremely misleading in the weeks prior to black friday companies increase the base price of their goods and then offer discounts such as 50 off the whole store
essay30,for example people are typically positively affected by calorie labels on menus making the nudge a good thing
essay30,an example of this are the various fad diets that are targeted at teenagers who want to lose weight
essay30,for example if you offered your friend a burger while they are on a diet it is up to them to make the final decision
essay88,examples include presentation of information changes in physical environment changes in default social norms and herding and commitment and implementation of plans which will be discussed further later on
essay88,an example is food at the grocery store
essay88,because nudging in this example is merely placing objects at different places on shelves it is hard to prevent stores from using this tactic in a harmful way one that is against the best interest of individuals
essay88,another example of nudging changes in default can help increase society s generosity donations in a non coercive way
essay88,an example of this is opt out versus optin policies for organ donation
essay88,an example is how online websites use the opt out method when asking customers if they would like to subscribe to emails
essay88,for example if healthier food options are placed at eye level in a grocery store and you want something sweet you can still pay closer attention to your desire and choose the unhealthy option
essay88,for example a nudge to encourage people to save money may not be effective for low income individuals who may not have the financial resources to save
essay67,for example thaler and shlomo ben artzi found in their paper save for tomorrow using behavioral economics to increase employment savings that automatically enrolling employees in retirement savings accounts led to around 80 of the participants remaining enrolled
essay67,for example nudges that exploit the scarcity effect or social norms to encourage impulse buying can be seen as manipulative
essay67,examples such as this one highlight the dangers of nudging when leveraged for profit in a capitalistic economy
essay67,nudges that disempower individuals can also have negative psychological consequences such as learned helplessness or reduced self efficacy
essay67,for example nudging individuals to reduce their energy consumption may inadvertently increase the use of non environmentally friendly alternatives such as candles or wood fires
essay67,for example nudges may not be effective for all individuals or in all contexts
essay67,to ensure that nudging is a useful tool and not a harmful one policies such as transparency should always be taken seriously
essay89,putting healthy food at eye level or placing a recycling bin next to every trash can are great examples of nudging with pure intentions
essay89,however not all examples of nudging areas ethical as caring for the environment or placing importance on nutrition
essay89,if done correctly ballot questions can provide a form of direct democracy to such a vast country
essay89,this is a clear example of unethical nudging
essay89,voter ballots prolife prochoice propaganda and fake news are all examples of unethical political nudging
essay66,conducted research that applied nudging to health research in topics such as weight loss managing chronic diseases and improving maternal and child health
essay66,the research raised questions such as who controls the nudge rs and best interest according to whom codagnoneetal909
essay66,for example they researched responses to different nudges dissuading smoking
essay66,these type one nudges are a clear example of unethical usage of nudging as it removes the freedom of choice
essay66,for example a study done at the university of toronto found that nudging students to study more resulted in them studying less ohara
essay66,while this is just one small example these unintended consequences can result from any type of nudging and may influence peoples behavior in unexpected ways
essay66,the examples mentioned previously are all small scale but in areas such as politics the effects of nudging can be catastrophic
essay66,for example many political campaigns aim to nudge peoples system one of the dual process of thinking and if they are successful they can sway elections and change the course of political leadership and the future of the country
essay31,nudging can serve as a complement to other ways to achieve a socially desired outcome such as through legislation or by enforcement
essay31,there are many domains in which nudging has shown to be effective in influencing positive behavior such as areas in health and the environment
essay31,for instance making changes to the default option is an easy change that can have positive impacts on peoples decisions
essay31,one instance of using nudging for manipulation is the potential for exploitation
essay31,one instance of this is the use of priming to influence consumers willingness to pay for a product in a digital marketplace
essay31,it is also unethical to target certain consumers who may be more susceptible to nudges such as those with lower income or education
essay27,for example putting fruit at eye level in a high school cafeteria is a way to try and influence students to be healthier
essay27,for instance the default setting when printing something can be set to printing on both sides of the paper rather than only on one side
essay27,one example of this is the default settings for social media
essay27,lastly there are instances of nudging that are not necessarily unethical yet they produce negative outcomes
essay70,nudges are influential and have a positive impact on the progress of society and have been adopted in developed countries such as the united states france and the united kingdom
essay70,more specifically people often make bad decisions due to factors such as not fully considering their options
essay70,for example non communicable diseases mainly heart disease diabetes and chronic lung disease account for nearly 70 of global deaths
essay70,most of these diseases are caused by unhealthy lifestyle habits such as smoking alcohol consumption and unhealthy diet slinosmanashcroft2017
essay70,the government will not force people to make choices such as banning all junk food which would result in huge costs and affect socioeconomic development
essay70,for example healthy foods could be placed more prominently in cafeterias and restaurants
essay70,for example food companies will give more benefits to shopping malls by asking them to advertise their products more and pull down the quality of their competitors which leads to unfair business competition
essay70,when nudges are applied positively such as encouraging people to increase exercise or healthier eating habits they may be seen as helpful or necessary
essay85,this essay will discuss the benefits and drawbacks of nudging in achieving desirable social outcomes evaluate the ethical concerns that arise from nudging people towards specific choices and provide concrete examples of successful nudging strategies
essay85,however some nudges may be more effective if they are subtle such as using social norms to influence behavior
essay85,certain groups of people may be more susceptible to nudges than others such as those with low levels of education or limited cognitive capacity
essay85,2017 argue that health nudges can be ethically justified if they are designed to promote behaviors that are in individuals long term interests such as eating a healthy diet or exercising regularly
essay93,an example of nudging would be a sign in a college dorm bathroom that says join your fellow classmates in reducing water waste by taking five minute showers instead of inhibiting the students freewill the choice to conserve water has been presented to them in a different light
essay93,a classic example of a successful climate nudge is changing the default setting of household energy plans to green or renewable as opposed to the past default of gray or fossil fuel energy braun
essay93,for example people tend to ignore suggestions such as turning off the lights in their house when they are incentivized by advice that says they will save money and improve the climate braun
essay93,in denmark for instance consumers did not change their fat consumption when a tax on high fat foods was passed braun
essay93,one such example of these nudging tools are buffets at company events consumers happily eat plant based food that is offered to them at work events simply because its right in front of them braun
essay93,interestingly many people misinterpret the intentions behind nudges for instance a climate denial ist may interpret a nudge to bike as a health based nudge when it is actually a climate nudgesiipiandkoi228
essay7,there are numerous examples of successful ethical nudges
essay7,another example takes place in london
essay7,the last example is from houston airport where they faced a problem of customers complaining about how long baggage claim took
essay7,5 all of these examples illustrate situations in which your behavior is manipulated in a small way but for the benefit of yourself and everyone
essay7,for example the uk government made it a requirement for people to work a certain amount of hours to qualify for a pension
essay50,for example when apples are placed at eye level in a cafeteria instead of twinkies more people end up choosing apples and choosing the healthier option contributes to public health nys
essay50,additionally some countries such as china and south korea have high levels of trust in their government and have shown an overwhelming approval of nudge keating
essay50,on the other hand countries with low levels of trust such as hungary which only has 28 of trust have low levels of approval in the implementation of nudge keating
essay50,for instance in a project that aimed to reduce the average households consumption of energy they sent out letters to inform people of how much they were using compared to other households in their neighborhood
essay50,an example is supermarkets placing snacks that are unhealthy at the cash registers which nudges customers into buying them when they are waiting in line to check out shatz
essay50,there are also instances where nudging harms the people that are being nudged
essay50,com nudge text for 20example2c20sending20 people 20atheir20 application 20for20student20aid
essay46,many bring up ethical concerns such as the negative effects it can have on an individual or the lack of transparency
essay46,for example to do ista to do list application contains a gam ification element that gives the users points for doing things like adding and completing tasks 1
essay46,there are also several tiers for specific point milestones for example an enlightened tierat50000 points
essay46,another example is the strategic placement of healthier food options at eye level in grocery stores
essay46,for example an experiment conducted by johan ege bark and mathias ek strm tested two strategies for decreasing paper use for printers 2
essay46,for instance you tubes recommendation system collects user data and uses an advanced algorithm to recommend videos to a user 3
essay46,youtube also uses several nudges within its recommendation system such as recommending similar videos after a user finishes a video or turning on autoplay by default
essay46,for example the ios operating system contains a significant locations feature which tracks where an individual has been recently and how frequently they visit places 4
essay46,for example all ios users should have knowledge of the significant locations feature through a popup prompt that directly tells the user what the feature does and gives options to either keep it on or turn it off
essay46,for example the nudge where healthier food options are placed at eye level in grocery stores would be more effective if kept hidden
essay46,however for nudges to be successful and ethical regulations such as counter nudges or required disclosure should be applied
essay101,additionally nudges may reinforce existing power imbalances and disadvantage certain groups such as those with low education or income levels
essay101,thus the efficacy and acceptability of nudges may differ across cultures and it is essential to consider these differences in designing nudges
essay101,nudging has been used successfully to achieve desirable social outcomes such as increasing organ donation rates reducing energy consumption and promoting healthy behavior
essay101,for example nudges encouraging healthy eating habits may need to address the underlying social and economic factors contributing to unhealthy eating habits which may vary across cultures vecchio and cavallo 3
essay11,for example last summer i did an internship at an investment firm in shanghai china where everyone was in a good frame of mind even though everyones workload was very high
essay11,in my opinion this is a good example of nudge in intent part
essay11,i didnt think i spent much last month but once i saw the bill i realized that i spent far more than twice what i thought i did
essay11,this is an example of manipulate serving the interests of the manipulator at the expense of the individual
essay11,hence intent is an example of the difference between nudge and manipulate
essay11,a good example of nudge here is at my fathers organization the company pays to train some employees for some financial certificates such as cpa or frm and the cost of the exam is fully reimbursed by the company
essay11,there is an example of nudge from an electric company companies can promote respect for customer autonomy by providing detailed data on energy use clearly stating the effects of energy efficiency measures and offering incentives to encourage energy efficiency thereby driving customers to make more environmentally friendly and economically sensible choices about their energy use
essay11,there is an example of nudge from an electric company companies can promote respect for customer autonomy by providing detailed data on energy use clearly stating the effects of energy efficiency measures and offering incentives to encourage energy efficiency thereby driving customers to make more environmentally friendly and economically sensible choices about their energy use
essay11,in the example of manipulate i think of tik tok which is now the most popular software of the moment
essay11,an example of manipulate is that some advertising companies will take a product such as an electric toothbrush and make it viral with advertisements for electric toothbrushes all around us which will cause us to think of that advertisement and buy it as soon as we think of electric toothbrushes thus ignoring other better products
essay11,one example of nudge is this i went for a physical last summer and on the wall in the hospital there were many posters in which is a w lungs that had gotten lung cancer after decades of smoking cigarettes as black as coal
essay11,there are examples of manipulate ive seen in the news where some processors falsify ingredients on food packages and this manipulation may be done without regard to the consumers true health concerns and only to increase sales and meet the company s profit goals
essay11,in intent i made an example of leisure facilities in the company and the quality of the food and credit card bill to demonstrate the difference between nudge and manipulate
essay11,in autonomy parti use example of electric company and tik tok to show the difference between nudge and manipulate
essay11,finally in ethical considerations i make an example of the difference of two lungs and falsification of food ingredient lists to specify the difference between two words
