essay_id,example sentences
essay62,for example if i drive into a town ive never been to before i have no way of knowing which restaurants are superior to others
essay62,a very illustrative example of this is the anti vaccination movement in the united states
essay98,one successful example of a nudge that demonstrates its potential to improve long term financial wellbeing is the automatic enrollment of employees in a retirement savings plan such as a 401k plan
essay98,incorporating these real world examples into the discussion of nudges and their ethical implications highlights the tangible benefits that can be realized when nudge strategies are designed and implemented in a responsible and transparent manner
essay98,for example external forces rather than nudge itself affect peoples freedom of choice
essay98,for example advertising is a commercial nudge that can significantly influence purchasing decisions by shaping peoples preferences perceptions and aspirations
essay98,a real world example is the tobacco industry s advertising campaigns in the mid20th century which glorified smoking and targeted specific groups of people such as women and teenagers to expand its customer base
essay77,there are many successful examples of nudge strategies used in various situations
essay77,here san example nudging has helped raise organ donation rates in some countries
essay77,while the example of the spanish governments use of nudging to increase organ donation rates shows the potential benefits of nudging there are still some drawbacks to consider
essay77,for example if a supermarket deliberately places unhealthy or un salable snacks at eye level to encourage impulse buying it could be seen as manipulating consumers choices
essay77,for example if an organization wants to encourage its employees to take selective regular breaks it might use transparent incentives such as reminders that are clearly communicated to employees
essay20,examples include placing healthier foods at eye level automatic enrollment in pension plans and employing social norm feedback to enhance compliance with public policies
essay36,nudge is a key example of how economies can utilize psychology to achieve particular social aims such as these
essay36,for example supermarkets may place healthier food options at eye level to encourage healthy eating
essay36,for example the uk government made it mandatory for people who work a certain number of hours to pay into a pension scheme but since this pension scheme was the minimum that one could possibly pay into it would most likely not be enough to grant them financial stability after retirement mullet p
essay36,for example a project to reduce energy consumption through letters on their current consumption resulted in people who learned that they consumed less energy than others in their area to start increasing their usage mullet p
essay36,if people are unaware of alternatives in a default option situation for example their freedom of choice is essentially nonexistent as awareness and informed consent are fundamental to free choice
essay36,for example in markets with commission based advice models an advisor can strategically use nudges to influence customers to buy more financial products that generate higher fees and sales incentives for the advisor but that are not in the customers best interest cheng p
essay36,first some of these criticisms such as the point that nudging diminishes individuals ability to make their own choices reston misconceptions
essay61,an example of this can be seen when someone is purchasing an item on a website or in a store
essay61,an example of this sort of nudging having a benefit can be seen in school cafeterias
essay61,while in most cases this can be seen as acceptable there are also some examples of nudging in which people are manipulated into thinking their options are more limited than they actually are
essay61,one example of this is gym memberships
essay16,on average an adult makes over 30000 conscious decisions a day and often chooses poorly based on heuristics and cognitive biases such as base rate neglect and anchoring biases
essay16,for example a study done in the uk introduced a small charge for single use plastic bags at retailers
essay16,this is a great example of how changing the environment around the consumer can influence their choices
essay16,this is an example of changing the defaults of an individuals decision
essay16,for example the study aiming to improve public health through the arrangement of healthy foods in a cafeteria disregards the ethical issue of transparency as they are not aware that their decisions are being influenced by the physical layout of their environment
essay16,nudges are designed to promote beneficial behavior and can greatly enhance social welfare such as the raised enrollment rates in organ donations
essay41,this is not a coincidence but an example of nudging
essay41,this essay discusses the ethical implications of nudging for example exploring the delicate balance between covert manipulation and genuine beneficial guidance
essay41,in a grocery for instance putting healthier foods at eye level is a nudge but concealing less healthful options would lean more toward manipulation
essay41,the degree to which it is appropriate for outside forces such as governments to influence individual decisions is raised by this raising ethical questions
essay41,a push to eat healthily such as putting fruits and vegetables in the front of a store could unintentionally mislead people about the eating habits of other cultures or disregard the needs of people who follow different dietsmedina2021
essay41,these examples show the wide range of possible outcomes from nudges
essay41,ethical implications of nudging certain demographic groups such as adolescents the elderly or those from low income families may be more susceptible to nudges
essay41,it also brings an array of ethical difficulties such as the potential for manipulation the effect on personal autonomy and the requirement for cultural sensitivity
essay57,nudge is increasingly used in public policy to encourage individuals to make healthier more socially desirable choices such as quitting smoking or saving money
essay57,for example a hidden nudge might deceive individuals into making choices that are not their own
essay57,take unhealthy diets as an example
essay57,the nudges focus on improving how people present information to make food choices such as providing calorie counts on food menus to draw attention to healthy and unhealthy choices
essay57,however freedom of choice is not preserved in the successful examples cited above
essay94,for instance encouraging individuals to donate money may be seen as positive however nudging people towards supporting particular political parties could be seen as unethical
essay94,for instance encouraging more people to save for retirement would be considered ethical since it promotes beneficial actions without restricting personal choice
essay82,the idea behind nudging is that people are often influenced by factors beyond their conscious awareness or control such as the way choices are presented to them
essay82,now that the concept is explained throughout this paper we will discuss examples of successful nudging strategies and assess the ethical implications of performing this act
essay82,there are many examples of nudging that benefits a lot of different individuals
essay82,while this example of nudging sounds like all positives for everyone this strategy also opens the door for many negative effects on peoples lives because of nudging
essay82,there are sure many better examples for a bad nudging scenario but the first one that comes to mind is the phone upgrade plans from all the mobile service providers
essay82,now that we saw two different examples of how nudging works comes the question how ethical is this practice
essay82,so yes i truly believe this is a very unethical practice but in away not every nudging practice is unethical as we saw in one of my examples
essay82,like i said nudging definitely seems like a marketing play and is it really wrong to try to get someone to for example buy your product
essay83,one example he highlights is how we can use choice architecture the concept of altering specific characteristics of an environment to influence people to eat healthier food options
essay83,in this scenario the companies wouldnt care if the option most benefited the consumer because they wouldnt consider the consumers best interest
essay83,thaler uses an example of a restaurant that uses various tricks to push the more profitable dishes on a menu
essay83,for example the restaurant could place large images near only the profitable dishes and can also add a very descriptive caption to entice the consumer to choose that particular dishthaler87
essay83,another example is how companies try to use automatic services to enroll their customers in subscriptions that the customer may not even be aware of
essay95,one example would be in my high school almost all the students would need to record their residence and the people would be automatically defaulted and be assigned to live in a dorm if they do not write a proposal to the school informing the teachers and administrators and obtain a permission of leaving campus during weekdays afternoons
essay95,the birth control policy typically the one child policy could be served as an example
essay95,for example it is common for the food seller to be with a fancy diagram and posters or advertisement showing the food to be in good shape and seemingly tasty
essay1,for example changing a tipping system to default the consumer paying 20 gratuity
essay1,one example was their smart savings plan
essay1,with this example the us lowered its autonomy but still derived benefits
essay1,for example the us has freedoms that apply to all citizens that most countries do not allow
essay1,this is an example of how giving up autonomy can be a positive for the collective welfare of peoples
essay1,lets discuss another example better grades
essay1,take for example the social media nudges
essay56,for example instead of telling a10 year old child to go to bed and expect them to get ready on their own a parent can try to do it with them creating a culture where getting ready for bed can be better or maybe even pleasant
essay56,for example if an action causes 80 of your classmates to fail a class but20 to pass does the placement of 80failingand20 passing before or after one another change the decision made
essay56,thaler and sunstein s work nudge begins with an example of the changes in the physical environment nudge although it is fictional 2008
essay56,looking at the overall definition of nudge it is considered by founders thaler and sunstein to be an example of libertarian paternalism thaler sunstein 2008p
essay56,so when libertarian modifies paternalism it describes an action done by a choice architect for example the cafeteria worker who rearranged the food attempting to influence choices of individuals but ultimately the individual has freewill and can decide against the influence
essay56,for example it is a societal norm for americans to want to be organ donors 95 of americans are in favor of being an organ donormullett2022
essay56,this is an example of the changed default nudge
essay56,another example of the societal norms nudge is the commercials that were put out to encourage covid19 vaccinations
essay56,this is an example of presentation of information nudge because they could have said 1outofevery10covid deaths were people younger than 50 but that does not nudge the audience they are targeting
essay56,that is because people can repost advertisements such as the covid19ads to show they are in support of vaccinations
essay56,one of these examples is the jonestown massacre
essay56,some of his final words are an example of the societal norms nudge if we cant live in peace we must die in peace eldridge 2023
essay56,this nudge saying that the entire congregation must choose to do this is an example of how nudge can have negative effects on society
essay56,for example if you give your friend a peanut butter sandwich that is not inherently good or bad
essay40,what might cause this vast difference in such a common decision
essay40,the idea behind creating a staircase such as this is called nudging
essay40,an example of this is putting unhealthy options like donuts in a harder to reach place than fruit thus improving the choices that people make for themselves
essay40,these are clear examples of nudging by businesses because they are not changing the economic incentives behind the purchases consumers make but they influence the actions consumers make nontheless because they change the context in which those decisions are made
essay40,when people engage with organizations such as these they do so under the assumption that the organization is seeking to promote goodwill and help people
essay40,the problem is that if the students put their trust into an organization such as a university to lookout for them and promote their wellbeing nudging them in this way violates the students
essay17,for example as evidenced by a recent study conducted by the uk behavioural insights team nudge can tackle the savings crisis which has worsened since the covid19 pandemic
essay17,for example in philadelphia in2008 the road planning officials wanted to encourage safer driving
essay17,the framework for unintended consequences could even analogously be applied to the earlier example of household savings within the united kingdom
essay17,for example what if the app prompted users to become too savings obsessed
essay17,through the examples mentioned it becomes clear that nudge can specifically be used as a tool to promote healthier and more sustainable practices that show a correlation to better microeconomic and macroeconomic performance
essay17,however the counterexample suggests that while there may be a good intention linked to achieving an economic objective there is precedence of negative consequences arising from nudge which are often not considered when designing the choices
essay37,changes in default are the third kind of nudge which can be seen in the common example of organ donation some countries have made being an organ donor the default option when getting a drivers license until and unless someone opts out
essay37,for instance if part of an employment package involves setting aside a part of every paycheck for retirement funds employees are more likely to start saving up for retirement early and more consistently
essay37,choice architects embodied in many of the companies or employers mentioned in the above examples use nudging to subtly influence an individuals choice to favor the most beneficial or effective one
essay37,addressing some critiques can improve the ethics of nudging theory but there will always be examples with immovable concerns regarding the preservation of freedom of choice
essay21,while nudges aim to enhance societal outcomes such as health or environmental conservation they must navigate the fine line of not undermining individual values and freedom
essay99,however is such action in and of itself a direct restriction on that individuals freewill or is it still taking into respect that persons autonomy
essay99,for instance these tools could easily be implemented to promote a certain pro environmental behavior at a very cheap cost
essay99,the researchers found that a potential reason for this is that kazakh students are exposed to an informational video on recycling while uk students do not have such a video
essay99,in such a sense it may be thought that nudging does in fact reduce the autonomy of an individual by not providing an objective concrete outlook on the situation that presents itself
essay99,however even though such a concern may be viable is such an idea truly disrespectful to humanity
essay99,researchers nys and engelen discuss this further through the example of a cafeteria deciding where to place its apples and twinkies that will best incentivize people to choose the healthier option
essay99,even though such a tactic does utilize non rational influences it does so in order to help individuals consider whats best
essay99,such a principal can be seen by researchers boc ou metal who studied the effects of nudging households to take up health insurance in countries where life insurance uptake was very low
essay99,the concern that arises however is the idea on whether such an action is truly the right way for the individual to make these rational choices
essay99,such a question brings about the conversation about what would occur if no nudges were present
essay99,although critics of the theory argue for such a scenario many do not take into consideration how biased humans truly are
essay99,consider nys and engelen s example of the apples and twinkies in the cafeteria once more
essay99,for instance upon labeling calorie information on menu boards in fast food restaurants within new york city researchers found that after a period of five years there was no significant change in the frequency of visits to fast food restaurants nor was there much of a change in the nutrients or number of calories purchased cantor et al
essay99,because of this theres no way in which such a nudge could be labeled as manipulation
essay99,could the nudge towards the apples be considered manipulation simply because it worked in its goal while the one in new york city could not be considered such since it did not work
essay99,this is not the only case of such a nudge failing as nudging interventions have also been utilized in order to help improve college achievements within undergraduate students
essay99,although the overall goal of shaping ones behavior may sound manipulative such tactics are seen throughout all of society and are generally unavoidable
essay99,otherwise we may run into the same cycle of implementing harsher more expensive policies to help fight problems such as climate change or growing obesity rates
essay76,for example a cafeteria might nudge people towards healthier food choices by placing fruits and vegetables at eye level and putting junk food in a less prominent location
essay76,another example is using default payday options to encourage people to save more money for retirement
essay76,for example restaurants nudge highway drivers to stop and buy food from them during their long drive by posting billboards along the road reminding them to eat
essay76,nevertheless this essay is ultimately unable to go through every possible example
essay76,nudge practitioners should carefully consider these factors and consult with relevant stakeholders to ensure that nudges are used in a responsible and ethical manner
essay76,it seems that suggestions and encouragement fall under the definition of manipulation as much as nudging would and thus i find it ethically unnecessary to eliminate nudging
essay10,when we think of nudging many everyday examples include putting healthier food on eye level advertising for certain products knowing that consumers are healthy and advertising for the gym charging customers for the use of plastic bags to the everyday consumer these examples of nudges are designed to steer people toward certain behaviors without restricting freedom of choice
essay10,for example physicians must provide outcome information either in terms of fatality rate or survival rate and cafeteria managers must choose something to put at eye level in the displays
essay10,in the example the source provides placing healthier foods at eye level in a supermarket can be an example of guiding decision makers into being healthy
essay10,however placing the most profit yielding foods at eye level is an example of manipulation because they do not have the consumers best interest in mind and only seek to serve the supermarkets agenda
essay10,when the government uses nudging to promote healthier food choices for example putting a low fat label on certain foods to encourage a healthier life style may increase some consumers intake because of decreased consumption guilt
essay10,by understanding these negative drawbacks one can take actions to mitigate them for example there should be policies set so that institutions find it more difficult to nudge decision makers for their own personal gain
essay47,this concept has gained traction in many fields such as public policy and healthcare as a means of benefiting the consumer
essay47,for instance the save more tomorrow program led by economists richard thaler and shlomo ben artzi successfully nudged workers to allocate a portion of their future salary increase toward retirement savings
essay47,1 another successful instance of nudging is seen in organ donation when the default setting is to donate
essay47,for instance the warning labels on cigarettes can actually reinforce smoking behavior if individuals react negatively to the nudge
essay47,for instance a nudge on littering in new york city could go along way towards cleanliness by just influencing people to be more conscious of their trash
essay47,this is because governments can be highly beneficial in areas such as education health care and 5deridderkroeseandgestel nudge ability 354
essay47,if for instance a simple nudge can encourage people to eat much healthier or save much more money it would be almost criminal if the government neglected using it
essay47,in away the government is morally obligated to use the nudge in such a situation
essay100,however manipulation affects peoples behavior and decision making through coercive ways such as deception coercion and threat and people do not have the right to choose independently
essay100,for example some shopping sites will nudge people into buying a product by making it the default option thereby increasing sales
essay100,although these examples employ some of the nudge theory s techniques their purpose is not to help people make better decisions but to achieve some commercial or personal interests
essay100,one organization for example has devised a nudge plan to encourage greener transport
essay51,for instance one of the typical examples of social norm herding plays an important role influencing the market
essay51,presentation of information is another typical example of nudge
essay51,overall the two examples of nudges mentioned could be beneficial to the society boosting the market to operate favoring people to make their choices fast
essay51,for example to prevent inflation the government raised the interest rate
essay51,a typical example of nudges affecting autonomy is the default settings
essay51,such issue could be serious in a society tied up to the nudges
essay51,in a high income countries with more saving habits such as switzerland might have a different result
essay51,a typical example is provided by the journal transparency versus informed consent when an individual is choosing a doctor for checkup in the hospital the existence of informed consent and transparency would urge the patient to struggle choosing the appropriate paradigm and the boundary for medicine
essay6,for example a nudge might be placing healthier food options at eye level in a cafeteria to promote healthier eating choices
essay6,a prime example of manipulation through nudging can be found in the privacy options on social media platforms
essay6,for example clear nutritional labels on food products and the placement of tobacco products behind the counter can help individuals make healthier choices without restricting their freedom to choose
essay6,the risk for manipulation could be mitigated by ensuring that nudges are designed to be as transparent as possible and that they leave ample room for individuals to make an informed choice
essay6,whatever you believe nudges should as much as possible strive to maintain individual autonomy and promote rational decision making
essay6,susceptibility could be due to various factors such as a lack of information cognitive biases or socioeconomic factors that can limit the ability of individuals to evaluate their choices fully
essay92,within nudge theory there is a clearly desired outcome such as saving more money for retirement
essay92,a good example of this is a study examining the effect of nudge on printing habits
essay92,in other cases nudge could also shame people for addictive behaviors or trigger difficult responses such as an eating disorder when nudged towards certain behaviors
essay84,for example schools and society highly value education which immensely affects and determines society s growth and wellbeing
essay84,another more advanced example of nudging benefiting our society is the application of game theory in controlling negative externalities
essay84,hidden factors involve such as whether it is truly fair for the nudged part to act in the desired way or whether the consequences for not acting the desired way are unfair to them
essay84,relating these factors back to the examples mentioned above it might be ethical in the scholarship case where students are encouraged to work hard although there might be problems of overpressure or stress created
essay84,tik tok awards users with social media interactions such as likes or comments that they need to work hard from building content to achieve
essay84,through the example of tik tok and policymaking we can see that there are many dangerous potential unintended consequences of nudges
essay84,therefore it is vital for governments to have detailed explanation and transparency in their decisions such as policymaking so that potential consequences are early foreseen
essay84,relating it to the examples we had some might find the speed limit of 45 creating him impatience while others feel safe driving at that speed
